{
  "session_id": "session_demo_001",
  "teen_id": "teen_demo_001",
  "raw_transcript": "vướng ba lịch một lúc luôn... khó chịu chứ >> cáu với mọi người xung quanh ấy >> Thế mẹ có bao giờ hỏi con thế nào không? >> Có ạ... Con nói là bình thường",
  "session_date": "2026-03-26T00:00:00Z",
  "family_goals": ["cải thiện kỷ luật", "giảm screen time"]
}

