{
  "session_id": "session_sample_003",
  "teen_id": "teen_demo_001",
  "raw_transcript": "[MENTOR]: Hôm nay ở lớp con thấy thế nào?\n>> [TEEN]: Con thấy hơi áp lực vì tuần này kiểm tra nhiều.\n>> [MENTOR]: Điều gì làm con áp lực nhất?\n>> [TEEN]: Lịch học bị dồn, con sợ không kịp bài.\n>> [MENTOR]: Khi về nhà con có nói với mẹ không?\n>> [TEEN]: Con hay nói là bình thường thôi, vì con sợ mẹ lo.\n>> [MENTOR]: Nếu con nói trước 'hôm nay con khó chịu vì lịch', con nghĩ mẹ sẽ phản ứng sao?\n>> [TEEN]: Chắc mẹ sẽ hỏi kỹ hơn, con cũng đỡ cáu.\n>> [PARENT]: Mẹ muốn con chia sẻ, mẹ không mắng.\n>> [TEEN]: Vâng ạ, con sẽ thử nói sớm hơn.",
  "session_date": "2026-03-28T00:00:00Z",
  "family_goals": ["cải thiện giao tiếp", "giảm xung đột"]
}
