{
  "session_id": "session_demo_003",
  "teen_id": "teen_demo_001",
  "raw_transcript": "dạo này con hay né nói chuyện ở nhà >> mẹ thấy con đi học về là vào phòng luôn >> em chỉ mệt thôi ạ >> con có thử nói với mẹ là con đang áp lực lịch chưa? >> con chưa nói, con sợ mẹ lo >> bố chỉ muốn con chia sẻ hơn",
  "session_date": "2026-03-27T00:00:00Z",
  "family_goals": ["cải thiện giao tiếp", "giảm xung đột"]
}

